Unnamed: 0,country,description,points,price,province,title,variety,winery,wineType
3835,Italy,"Here's a classically crafted selection, with a lovely floral and earthy fragrance. The palate shows dark-plum and black-cherry flavors laced with white pepper, mint and balsamic accents. While it has tame acidity, it's still tightly wound and needs just a few years to soften and develop additional complexity; drink after 2015. Vi Wines, J & J Importers.",93,22.0,Tuscany,Antico Colle 2010  Vino Nobile di Montepulciano,Sangiovese,Antico Colle,red
100549,US,"The Sangiovese comes from Red Willow Vineyard, and it would be hard to find a more lovely, elegant rosé from this side of the Atlantic. Light strawberry and melon aromas continue onto the palate, with pinpoint detail and precision.",92,18.0,Washington,Lauren Ashton Cellars 2011 Rosé of Sangiovese (Columbia Valley (WA)),Sangiovese,Lauren Ashton Cellars,red
90178,Italy,"This is a beautiful wine from a great vintage. It has a rich fragrance of underbrush, mushroom and truffle, with ripe black-cherry, mint and rosemary accents. It's still young with exuberant but supple tannins and racy acidity. Drink 2016–2025.",92,25.0,Tuscany,Villa Cafaggio 2010  Chianti Classico,Sangiovese,Villa Cafaggio,red
59303,US,"This is as good as Sauvignon Blanc gets in Washington—a dense, pungent, intensely aromatic and gloriously flavorful wine sourced entirely from the Klipsun Vineyard. Inaugural scents suggest wet hay, new-mown grass, fig and citrus. Following are flavors of pineapple, more citrus, beeswax and a suggestion of bee pollen. This is one of those bottles that empties much faster than you'd like.",94,20.0,Washington,Guardian 2012 Angel Sauvignon Blanc (Red Mountain),Sauvignon Blanc,Guardian,white
89867,France,"Old vines planted in the 1950s by a neighbor named Ovide form this complex wine. Aged for eight months on lees, it is a concentrated wine, tight with acidity and with nutty flavors that add complexity and give the wine depth. This beautiful wine needs to age. Drink from 2018.",93,25.0,Loire Valley,Pierre Morin 2014 Ovide  (Sancerre),Sauvignon Blanc,Pierre Morin,white
45452,US,"This wine is full of lovely aromas and flavors, but something unique about its grippy texture makes it soar. It begins with fresh, mineral-laced scents of Asian pear, yellow-grapefruit pith, crisp yellow apple and chalk. Then comes a palate full of yellow apple skins, lemon wedge and the slightest hint of grass, all served atop energetic, mouthwatering acidity.",93,19.0,California,Gainey 2014 Limited Selection Sauvignon Blanc (Santa Ynez Valley),Sauvignon Blanc,Gainey,white
26665,US,"Jewell threads the needle where so many others fail with this dry, elegant Sauvignon Blanc. Does exactly what it should, providing a mouthwateringly crisp white wine that scours and cleanses the palate. The flavors are of limes, lemons, grapefruits, wildflowers and stony, tangy minerals. Really a brilliant wine, among the best of its class.",93,24.0,California,Joseph Jewell 2008 Redwood Ranch Sauvignon Blanc (Alexander Valley),Sauvignon Blanc,Joseph Jewell,white
26675,US,"A beautiful, fancy Sauvignon Blanc, crisp and dry and complex. If you're looking for a California white to drink with a perfect roast chicken, it's a fine choice. Shows ripe, lush citrus, tropical fruit, peach, mineral and white flower flavors, finished with dusty cinnamon spices.",93,28.0,California,Conspire 2009 Sauvignon Blanc (Rutherford),Sauvignon Blanc,Conspire,white
101580,US,"Superb fruit highlights this tight, sculpted Syrah. It's extremely dense, with deep and intense raspberry and cassis fruit flavor, augmented with coffee grounds, smoke and iron filings. Complex, detailed, balanced and deep—what more can a wine give you? This is drinking very young and surely needs to be decanted. But already displaying amazing power.",96,20.0,Washington,Rulo 2007 Syrah (Columbia Valley (WA)),Syrah,Rulo,red
52635,US,"Dark and racy, with a Northern Rhône-style aroma of black pepper, cedar and black currants, but there's nothing Rhône-like about the flavor. It's distinctly California, with soft, sweetly ripe tannins bursting with blackberry jam, black currants, anise, vanilla and sweet oak flavors. The wine is fully dry. Absolutely first-rate Syrah.",95,27.0,California,Novy 2005 Syrah (Santa Lucia Highlands),Syrah,Novy,red
98441,US,"Here's a great Syrah from a vineyard not specifically known for this grape. It immediately impacts the palate with concentrated flavors of raspberry and cassis swathed in coffee liqueur, dark chocolate and a hint of red licorice. This has great concentration and length; drink it over the next 6–8 years.",94,28.0,Washington,Tamarack Cellars 2009 Ciel du Cheval Vineyard Syrah (Red Mountain),Syrah,Tamarack Cellars,red
68146,US,"This is likely the last vintage from this vineyard, which the family winery seemingly mastered in this bottling. There's an underlying umami-driven smoked meat backbone to the nose that also shows bold cherry blossom, olallieberry, pepper, dried herbs and blackberry-soy sauce. The palate is complex yet doesn't overpower, with bits of purple flowers, blueberry, black pepper and menthol.",94,28.0,California,Melville 2013 Verna's Syrah (Santa Barbara County),Syrah,Melville,red
52646,US,"Beautiful, irresistable Syrah, lush and sweet in fruit and oak. Soft and velvety, it offers layers of puréed raspberries, cherries, blackberries, blueberries and chocolate, with a rich edge of toasted marshmallow, gingerbread and butterscotch. Yet it's dry, with modest alcohol.",94,27.0,California,Novy 2005 Syrah (Russian River Valley),Syrah,Novy,red
23588,US,"The second edition of Chateau Rollat's Ardenvoir Sémillon includes eight percent Sauvignon Blanc in the blend, a nice addition that tightens up the mouthfeel. Barrel fermented, it's bursting with rich tropical fruit flavors, Meyer lemon, sweet toasted cracker and caramel, an exceptionally concentrated and full-bodied wine.",93,22.0,Washington,Ardenvoir 2008 Artist Series Sémillon (Columbia Valley (WA)),Sémillon,Ardenvoir,white
58242,US,"Silky and luscious, this extraordinary Sémillon from the makers of the Chateau Rollat red wines sends up cascading scents of orange blossom, orange peel, citrus and light tropical, moving into the mouth with beautifully integrated fruits dappled with honey and tea. Elegant and impressively long, it concludes with a light kiss of toast.",92,22.0,Washington,Ardenvoir 2007 Sémillon (Columbia Valley (WA)),Sémillon,Ardenvoir,white
57829,US,"This barrel-fermented Sémillon deftly mixes smoky toast with rich and deep fruit flavors of melon and grapefruit. Exceptionally concentrated and full-bodied, it carries forward into this new vintage the well-established style of Ardenvoir's unique take on Washington Sémillon.",92,22.0,Washington,Ardenvoir 2009 Sémillon (Columbia Valley (WA)),Sémillon,Ardenvoir,white
126310,Australia,"Scents of wet stone, paraffin and citrus ease into flavors of lemon, melon and tea on the palate. This is light in body and silky in feel, with a long, harmonious finish. Drink it now or age it up to 10 years, maybe even longer.",92,24.0,New South Wales,Silkman 2015 Semillon (Hunter Valley),Sémillon,Silkman,white
105193,US,"This is just about perfect Sémillon— the gorgeous fruit has more flesh and breadth with flavors suggesting ripe fig, melon and citrus. The use of oak is judicious and thoughtful; it adds grace notes without dominating. You can't help but wonder why this grape remains such a novelty (except, ironically, at Novelty Hill!). It's seductive, delicious and unique.",92,16.0,Washington,Novelty Hill 2005 Stillwater Creek Vineyard Sémillon (Columbia Valley (WA)),Sémillon,Novelty Hill,white
51966,US,"The winery holds back its wines to good effect. There's no sign of fatigue here, just well-integrated complex meaty flavors. It's dusky and dark, with aromas of smoke, tobacco and espresso. Flavors include all of the above around black fruits and slightly gritty tannins. It's dense and delicious and ready to drink.",93,28.0,Oregon,Dominio IV 2012 Three Sleeps Vineyard Sketches of Spain Tempranillo (Columbia Gorge (OR)),Tempranillo,Dominio IV,red
113880,Spain,"Crisp, toasty oak and spice aromas are currently outranking this wine's berry-fruit components...but only for now. In five or more years, this will be less oaky and more complex. At this point in time, look for a sinewy, tight, almost jagged palate with toasty, robust flavors of plum and berry, dry spices and mixed herbs along with firm tannins. A long, balanced finish bodes well for the future. Drink through 2030.",93,27.0,Northern Spain,Sierra Cantabria 2010 Reserva  (Rioja),Tempranillo,Sierra Cantabria,red
88439,US,"This is the winery's first commercial release of this varietal, all aged in neutral French oak. It offers nuanced aromas of spice, tobacco, vanilla and savory notes that are followed by plentiful, palate-coating red and blue-fruit flavors that extend out through a long, fruit and spice-filled finish. Firm tannins provide the structure. It needs time still but possesses a delicious factor that is impossible to ignore.",93,28.0,Washington,Waters 2012 Stone Tree Tempranillo (Wahluke Slope),Tempranillo,Waters,red
37020,US,"Bokisch has made a Tempranillo that's relatively light in body, bursting with an earthy tobacco tone, with a backbone of leather. The palate feels velvety, with soft but structured tannins, bearing black cherry and dark chocolate flavors. This has to be one of California's best Tempranillos.",93,21.0,California,Bokisch 2010 Tempranillo (Lodi),Tempranillo,Bokisch,red
108701,Spain,"Direct and woody on the nose, with aromas of graphite and vanilla, this opens in fine form. A tight, pure palate deftly blends weight, fine acidity and chewy tannins, while the flavor profile is earthy and blackened by charred oak, with blackberry fruit and savory, peppery spice notes. This is meaty, savory and beefy on the finish. Drink through 2021.",92,27.0,Northern Spain,Lecco 2011 Crianza  (Ribera del Duero),Tempranillo,Lecco,red
100677,US,"While crisp and bracing due to tart apricot and green apple flavors, this wine deepens on the palate as compelling white raspberry, white peach and subtle floral, spicy notes unfold. Markus Niggli added 5% North Carolina-grown Traminette, making it an interesting and seriously delicious bottle to enjoy over a seafood lunch or as an apéritif.",92,22.0,California,Markus Wine Co 2016 Insieme Torrontés (Lodi),Torrontés,Markus Wine Co,white
90511,Argentina,"A really good and clean white wine with all the tropicality and zest that this Argentine variety can give. The nose is crystalline and pure, with white flower scents of jasmine and citrus blossom, while the palate is round, melony and full of lychee and papaya. Smooth on the finish. Drink soon.",90,12.0,Other,Don Manuel Villafañe 2010 Torrontés (La Rioja),Torrontés,Don Manuel Villafañe,white
78500,Argentina,"Colomé regularly makes one of Argentina's best Torrontés. This vintage is fresh on the nose, with tropical leanings and lychee aromas. The palate offers pointed acidity and lively flavors of passion fruit, lychee and citrus. This finishes crisp and juicy, but not sizzling or sharp.",89,15.0,Other,Colomé 2012 Torrontés (Calchaquí Valley),Torrontés,Colomé,white
116741,Argentina,"Tropical fruit aromas come with notes of bath soap and white-flower blossom. This is easygoing and healthy on the palate, with just enough snappy acidity. Flavors of lime and green banana run long on the finish, which shows a touch of the variety's patented oily bitterness. Drink immediately.",89,19.0,Other,Alta Vista 2015 Estate Torrontés (Salta),Torrontés,Alta Vista,white
84573,Argentina,"Aromas of wild flowers, honey, lychee and oily citrus fruits announce a minerally palate with steely yet tropical flavors of citrus and lychee. This is better cut than most, with racy acidity that keeps things running on the finish. Drink now.",89,17.0,Other,El Esteco 2014 Don David Reserve Torrontés (Calchaquí Valley),Torrontés,El Esteco,white
6355,Italy,"Creamy and delicious, this beautiful white offers aromas and flavors of juicy pear, ripe green apple, white almond, sea salt, wild herb and ginger. Fresh acidity brightens the creamy flavors.",93,23.0,Sicily & Sardinia,Vigne Surrau 2014 Sciala Superiore  (Vermentino di Gallura),Vermentino,Vigne Surrau,white
52776,US,"Uvaggio is making a serious case for Lodi Vermentino. This bottling is compelling: savory with herb and green olive notes, and yet freshly fruity and delicate, well integrated and plenty acidic to stand up to a wide range of food, even given its modest 11% alcohol level. A stunner that'll keep you thinking, and asking for more.",93,14.0,California,Uvaggio 2009 Vermentino (Lodi),Vermentino,Uvaggio,white
82258,US,Full body and powerfully fruity flavors make this sweet wine seem extra bold. It smells like toasted almonds and dried meat and tastes like poached peaches. A smooth but lively texture keeps the flavors zinging on the finish.,92,20.0,California,Uvaggio NV Passito Vermentino (Lodi),Vermentino,Uvaggio,white
38694,Italy,"This 100% Vermentino opens with heady scents of Spanish broom, white wild flower, lemon blossom and citrus. The vibrant, savory palate boasts a pristine fruit purity, doling out juicy nectarine, ripe pear, lemon zest and mineral alongside refreshing acidity.",92,20.0,Sicily & Sardinia,Argiolas 2014 Merì  (Vermentino di Sardegna),Vermentino,Argiolas,white
49482,Italy,"Aromas of apple, exotic fruit and Mediterranean scrub lead the nose while the fresh, savory palate shows juicy white peach, mint and citrus zest. It has lovely balance, structure and finesse.",92,17.0,Sicily & Sardinia,Vigne Surrau 2015 Branu  (Vermentino di Gallura),Vermentino,Vigne Surrau,white
6267,US,"This tastes like a more concentrated and sweeter version of Stottle's dry Viognier from the same vintage and vineyard. Deeply concentrated, complex and creamy, it's loaded with citrus and stone fruits, honey and butterscotch, yet remains lifted by defining acidity.",94,18.0,Washington,Stottle 2011 Lucille Late Harvest Viognier (Yakima Valley),Viognier,Stottle,white
54769,US,"A rich and flamboyant Viognier. One might even call it majestic. Somehow it combines fabulously ripe, opulent fruit, honey and spice flavors with a savory minerality, leading to a dry finish. A real achievement in California Viognier.",93,29.0,California,Blair Fox 2010 Paradise Road Vineyard Viognier (Santa Barbara County),Viognier,Blair Fox,white
51653,US,"Sharp and focused, with fine-tuned varietal expression, this is flat out loaded with rich fruit flavors. Orange, lime, pineapple and pear can be found, all beautifully polished. It's ripe and precise without being bitter or hot, and a fine value as well.",93,23.0,Oregon,Quady North 2015 Steelhead Run Vineyard Viognier (Applegate Valley),Viognier,Quady North,white
71731,US,"This southern Rhône-style blend includes 10% each Marsanne and Roussanne. It's flat out lovely and silky smooth, with scents and flavors of honey-laced flowers. Lemon, lime and grapefruit dominate the palate, with superb balance and persistence. Certainly one of the best Washington State Viogniers I have ever tasted.",93,19.0,Washington,AntoLin Cellars 2010 Viognier (Yakima Valley),Viognier,AntoLin Cellars,white
43193,US,"This is a very sweet, unctuous dessert wine, with the flavor and texture of honey. Made from Viognier, it has decadent apricot, peach, tangerine and crème brûlée notes that combine in a dense, delicious mélange.",93,14.0,California,Novy 2006 Oley Dessert Wine Viognier (Russian River Valley),Viognier,Novy,white
6346,US,"Quite light in color, especially for the alcohol level, this wine offers dried red cherries, hibiscus, rose petals, pencil shavings and a touch of hot asphalt on the spicy and fun nose. Lots of lively red fruit energy comes forth once sipped, with nutmeg, clove spice, ginger snaps and molasses flavors rounding out a memorable pour.",93,21.0,California,Felten Cellars 2013 Zinfandel (Paso Robles),Zinfandel,Felten Cellars,red
124892,US,"This is a 100% varietal, dry-farmed and old-vine wine, peppered in cedar, raspberry and vanilla. It's soft and subtle on the palate, with pretty aromatics and a rich backbeat of juicy fruit. Balanced and with an underlying elegance, it delivers in every way.",93,25.0,California,Vite Vecchio 2013 Centanni Vineyard Zinfandel (Dry Creek Valley),Zinfandel,Vite Vecchio,red
49962,US,"This is Zinfandel at its richest. Boysenberry, vanilla and maple syrup aromas meet up with jammy fruit flavors that coat the mouth and linger on the finish. For all its fullness, it stays balanced and dry. It does not feel heavy in texture nor heavily oaked.",93,26.0,California,Earthquake 2012 Zinfandel (Lodi),Zinfandel,Earthquake,red
121160,US,"Better known for Cabernet, Ballentine brings a deft hand to their Block 9 Zin, which has earned high scores for years. The vineyard is in Calistoga, and the warmth has coaxed out intricate flavors of wild red and black berries and cherries, mocha, herbs and spices, with a distinct black pepper note. The tannins are thick, but very fine. Among the top Napa Zins, this wine will age for a decade or longer.",93,29.0,California,Ballentine 2004 Block 9 Reserve Zinfandel (Napa Valley),Zinfandel,Ballentine,red
121685,US,"Powerful, mouthwatering, concentrated black-cherry and blackberry flavors form the core of this full-bodied, full-flavored and well-balanced wine. Starting with aromas of toasted oak and wood smoke, the wine has a broad rich mouthfeel and moderate tannins that propel the gorgeous fruit flavors across the palate and linger a long time on the finish.",93,24.0,California,Shenandoah Vineyards 2015 Rezerve Paul's Vineyard Zinfandel (Amador County),Zinfandel,Shenandoah Vineyards,red